INSTITUTE NAME 	SEQUENCED GENOME COUNT
CSIR-Centre for Cellular and Molecular Biology (CCMB)	108
DBT-Centre for DNA Fingerprinting and Diagnostics (CDFD), Hyderabad	194
DBT- National Institute of Biomedical Genomics (NIBMG)	976
DBT-Institute of Life Sciences, (ILS) Bhubhaneshwar	194
ICMR-National Institute of Virology (NIV)	0
DBT-National Centre for Cell Science, Pune	90
CSIR-Institute of Genomics and Integrative Biology (IGIB), Delhi	0
NCDC, Delhi - Division of Bio-technology, Epidemiology and Central Surveillance Unit	0